title,description,short_description,Category,stock,price,regular_price,sales_price,weight,length,width,height,sku,picture,tags,tax_status,tax_class
Green Deen: What Islam Teaches About Protecting the Planet,'Muslims are compelled by their religion to praise their Creator, pray, fast and give charity. But what is not widely known is that there are deep and long-standing connections between Islamic teachings and environmentalism. In this ground breaking book, Ibrahim Abdul-Matin draws on research, scripture and interviews with Muslims to trace Islam&rsquo;s profound dedication to humankinds collective role as stewards of the Earth. Abdul-Matin points out that the Prophet Muhammad declared that the Earth is a mosque. Deen means path or way in Arabic. Abdul-Matin offers dozens of examples of how Muslims can follow, and already are following, a Green Deen in four areas: waste, watts (energy), water and food. At last, people of all beliefs can appreciate the gifts and contributions that Islam and Muslims bring to the environmental movement. Ibrahim Abdul-Matin''s deep connection with Islam and the environment helps to make his book clear, easy to read, balanced and convincing. - Harfiyah Abdel Haleem, Islamic Foundation for Ecology and Environmental Sciences, UK. Ibrahim-Abdul Matin not only shows the myriad ways American Muslims are contributing to the resolution of the environmental crisis that threatens us all, but he goes a long way toward humanizing the Muslim community by sharing with the reader the lives of so many extraordinary, talented and visionary people. Imam Zaid Shakir, cofounder, Zaytuna Institute.  Green Deen shows how the authentic religious values and practices of Islam should lead to a wholesome, healthy and compassionate lifestyle that benefits all living things. Abdul-Matin writes in accessible, intelligent and motivating language, making this an excellent book for all readers. Ingrid Mattson, PhD, President, The Islamic Society of North America','Muslims are compelled by their religion to praise their Creator, pray, fast and give charity. But what is not widely known is that there are deep and long-standing connections between Islamic teachings and environmentalism. In this ground breaking book, Ibrahim Abdul-Matin draws on research, scripture and interviews with Muslims to trace Islam&rsquo;s profound dedication to humankinds collective role as stewards of the Earth.',Books->Islam in General,50,9.99,9.99,9.99,0.34,,,,9781847740403,9781847740403.jpg,Ibrahim Abdul-Matin | Kube Publishing | 2012 | £5-10,taxable,zero-rate
Handbook for Hajj and Umrah,'An excellent practical and helpful guide book explaining the rites of Hajj and Umrah in a straightforward, concise and comprehensive manner. Contains helpful charts, maps and diagrams in full colour.','An excellent practical and helpful guide book explaining the rites of Hajj and Umrah in a straightforward, concise and comprehensive manner. Contains helpful charts, maps and diagrams in full colour.',Books->Spirituality & Theology,50,7.95,7.95,7.95,0.11,,,,9780860373407,9780860373407.jpg,Sarwar Alam Raz | The Islamic Foundation | 1999 | £5-10,taxable,zero-rate
Hannah and her Grandma,'Award Winning Story.  An Engaging Story which brings home the Truth related to God''s Creative Power and faith. The search for truth starts with Hannah a young and inteligent girl and her Grandma on a journey.','Award Winning Story.  An Engaging Story which brings home the Truth related to God''s Creative Power and faith. The search for truth starts with Hannah a young and inteligent girl and her Grandma on a journey.',Children->Islamic Studies,50,5.95,5.95,5.95,0.39,,,,9780860374404,9780860374404.jpg,Deborah A. Woodthorpe | The Islamic Foundation | 2005 | 9-11 years | £5-10,taxable,zero-rate
Hassan and Aneesa Go To Madrasa ,'Hassan and Aneesa are going to madrasa. At madrasa they will meet new friends and learn about Islam. Follow them as they get ready and go, for the first time, to madrasa.  Hassan and Aneesa series is designed to introduce young children to a range of new places. They are colourfully designed and simply written and will guide children through a range of new experiences.','Hassan and Aneesa are going to madrasa. At madrasa they will meet new friends and learn about Islam. Follow them as they get ready and go, for the first time, to madrasa.  Hassan and Aneesa series is designed to introduce young children to a range of new places. They are colourfully designed and simply written and will guide children through a range of new experiences.',Children->Picture Books,50,2.5,2.5,2.5,0.06,,,,9780860374596,9780860374596.jpg,Yasmeen Rahim | The Islamic Foundation | Hassan and Annesa Series | 2011 | 0-5 years | £0-5,taxable,zero-rate
Hassan and Aneesa Go to Masjid ,Hassan and Aneesa series is designed to introduce young children to a range of Muslim places. They are colourfully designed and simply written and will guide children through a range of new experiences.,Hassan and Aneesa series is designed to introduce young children to a range of Muslim places. They are colourfully designed and simply written and will guide children through a range of new experiences.,Children->Picture Books,50,2.5,2.5,2.5,0.09,,,,9780860375210,9780860375210.jpg,Yasmeen Rahim | The Islamic Foundation | Hassan and Annesa Series | 2012 | 0-5 years | £0-5,taxable,zero-rate
Heavenly Bites: The Best of Muslim Home Cooking ,'Heavenly Bites is the first multinational Muslim cookbook that features the best of Muslim cooking to be found from Morocco to Bangladesh, which is all par of the dynamic food culture of modern-day Muslim London, served up by Karimah bint Dawood, the TV presenter, cook and convert to Islam. With the ever-growing popularity of "Eastern" cooking in the Western world, this book assembles together some of the best-loved dishes, featuring 50 recipes for soups, salads, snacks and starters, smoothies, main courses and sweets. If you want to expand your cooking skillsor learn some new dishes from your Muslim neighbours or you simply want to learn more about the international tastes of the Muslim world, then this is the ideal cookbook for you. First Muslim cookbook, based on the best of Muslim cooking from Morocco to Bangladesh to be found in Muslim London. 50 recipes: soups, salads, snacks and starters, smoothies, main courses, marinades and sweets. Full of stories about food culture and cuisine in Muslim communities. Health tips. Cultural and religious wisdom about food and cuisine. Humourous and personal anecdotes about cuisine and culture. Easy step-by-step instructions. Fully illustrated. Measurements in metric and imperial, UK and US measurements.','Heavenly Bites is the first multinational Muslim cookbook that features the best of Muslim cooking to be found from Morocco to Bangladesh, which is all par of the dynamic food culture of modern-day Muslim London, served up by Karimah bint Dawood, the TV presenter, cook and convert to Islam.',Books->Women & Family,50,9.95,9.95,9.95,0.4,,,,9781847740311,9781847740311.jpg,Karimah bint Dawood | Kube Publishing | 2011 | £5-10,taxable,zero-rate
Hilmy The Hippo Becomes A Hero,'In this new adventure, Hilmy learns how to deal with bullying and how he should act if others need help. He soon realises the blessings of friendship and that God doesn''t love those who aren''t nice to others. Includes 12 colour illustrations.','In this new adventure, Hilmy learns how to deal with bullying and how he should act if others need help. He soon realises the blessings of friendship and that God doesn''t love those who aren''t nice to others. Includes 12 colour illustrations.',Children->Picture Books,50,3.95,3.95,3.95,0.28,,,,9780860373438,9780860373438.jpg,Rae Norridge | The Islamic Foundation | Hilmy the Hippo Series | 2003 | 0-5 years | £0-5,taxable,zero-rate
Hilmy The Hippo Learns About Creation,'This is another exciting tale of adventure and discovery for Hilmy the Hippo. In this charming story, Hilmy finds the answers to the many questions he asks his friends about the creation. Includes 12 colour illustrations.','This is another exciting tale of adventure and discovery for Hilmy the Hippo. In this charming story, Hilmy finds the answers to the many questions he asks his friends about the creation. Includes 12 colour illustrations.',Children->Islamic Studies,50,3.95,3.95,3.95,0.28,,,,9780860373131,9780860373131.jpg,Rae Norridge | The Islamic Foundation | Hilmy the Hippo Series | 2003 | 0-5 years | £0-5,taxable,zero-rate
Hilmy the Hippo Learns About Death,'Hilmy seeks an answer to the question - What happens to us when we die? Hilmy''s search for the answer takes him to the forest where the wise terrapin lives. In this touching tale, Hilmy learns that we belong to God and there comes a time when we must return to Him. Includes 12 colour illustrations.','Hilmy seeks an answer to the question - What happens to us when we die? Hilmy''s search for the answer takes him to the forest where the wise terrapin lives. In this touching tale, Hilmy learns that we belong to God and there comes a time when we must return to Him. Includes 12 colour illustrations.',Children->Islamic Studies,50,3.95,3.95,3.95,0.28,,,,9780860374602,9780860374602.jpg,Rae Norridge | The Islamic Foundation | Hilmy the Hippo Series | 2005 | 5-7 years | £0-5,taxable,zero-rate
Hilmy The Hippo Learns About Vanity,'Sometimes some of us think too much about our appearance. In this new adventure, Hilmy finds himself in the forest where he sees his reflection for the first time. Giant, the wise elephant, is on hand to teach Hilmy the truth about being vain. Includes 12 colour illustrations','Sometimes some of us think too much about our appearance. In this new adventure, Hilmy finds himself in the forest where he sees his reflection for the first time. Giant, the wise elephant, is on hand to teach Hilmy the truth about being vain. Includes 12 colour illustrations',Children->Picture Books,50,3.95,3.95,3.95,0.28,,,,9780860373988,9780860373988.jpg,Rae Norridge | The Islamic Foundation | Hilmy the Hippo Series | 2004 | 0-5 years | £0-5,taxable,zero-rate
Hilmy The Hippo Learns Not To Lie,'In this enchanting tale, Hilmy sets out to make some new friends, but soon learns a valuable lesson. It is not wise to try and impress others through lies. When Hilmy''s lies are put to the test he learns that friends like you for who you are and not for what you can do. Includes 12 colour illustrations.','In this enchanting tale, Hilmy sets out to make some new friends, but soon learns a valuable lesson. It is not wise to try and impress others through lies. When Hilmy''s lies are put to the test he learns that friends like you for who you are and not for what you can do. Includes 12 colour illustrations.',Children->Picture Books,50,3.95,3.95,3.95,0.28,,,,9780860373445,9780860373445.jpg,Rae Norridge | The Islamic Foundation | Hilmy the Hippo Series | 2004 | 0-5 years | £0-5,taxable,zero-rate
Hilmy The Hippo Learns To Be Grateful,'In this charming story, Hilmy, the Hippo, learns to be grateful&hellip;the hard way! This excellent book explores appreciating what we have and illustrates to the reader that the grass is not always greener on the other side.','In this charming story, Hilmy, the Hippo, learns to be grateful&hellip;the hard way! This excellent book explores appreciating what we have and illustrates to the reader that the grass is not always greener on the other side.',Children->Picture Books,50,3.95,3.95,3.95,0.26,,,,9780860373964,9780860373964.jpg,Rae Norridge | The Islamic Foundation | Hilmy the Hippo Series | 2002 | 0-5 years | £0-5,taxable,zero-rate
Hilmy The Hippo Learns to Share,'Hilmy the Hippo Learns to share. It is an honour when we are asked to share. But sometimes, like Hilmy the Hippo, we do not wish to share. In this exciting tale, Hilmy sets out on a new adventure and he learns the joy of sharing. The story takes us across the African savannah where we learn that sharing our good fortune is a privilege and a duty. ','Hilmy the Hippo Learns to share. It is an honour when we are asked to share. But sometimes, like Hilmy the Hippo, we do not wish to share. In this exciting tale, Hilmy sets out on a new adventure and he learns the joy of sharing. The story takes us across the African savannah where we learn that sharing our good fortune is a privilege and a duty. ',Children->Picture Books,50,3.95,3.95,3.95,0.28,,,,9780860375852,9780860375852.jpg,Rae Norridge | The Islamic Foundation | Hilmy the Hippo Series | 2007 | 5-7 years | £0-5,taxable,zero-rate
Husna and the Eid Party,'Everyone loves to be invited to an Eid party, so when Husna hears about Maryam''s party she can''t wait to get her invitation. Throughout the week Husna tries to get Maryam''s attention to see if she can remind her, but, everytime she does, something gets in her way. Husna begins towonder if she''ll ever be invited to Maryam''s party. ','Everyone loves to be invited to an Eid party, so when Husna hears about Maryam''s party she can''t wait to get her invitation. Throughout the week Husna tries to get Maryam''s attention to see if she can remind her, but, everytime she does, something gets in her way. Husna begins towonder if she''ll ever be invited to Maryam''s party. ',Children->Fiction->Children and Pre-Teen (7-11),50,3.95,3.95,3.95,0.21,,,,9780860374060,9780860374060.jpg,Fawzia Gilani | The Islamic Foundation | 2007 | 5-7 years | £0-5,taxable,zero-rate
I Can Make Dua Anywhere,'I Can Make Dua Anywhere!" brings into relief the Islamic teaching that we should always turn to Allah, seeking His help and thanking Him for His numerous favours to us. Making Dua makes our life more meaningful and satisfying. Includes 11 colour illustrations.','I Can Make Dua Anywhere!" brings into relief the Islamic teaching that we should always turn to Allah, seeking His help and thanking Him for His numerous favours to us. Making Dua makes our life more meaningful and satisfying. Includes 11 colour illustrations.',Children->Picture Books,50,4.95,4.95,4.95,0.31,,,,9780860373247,9780860373247.jpg,Yasmin Ibrahim | The Islamic Foundation | I Can Series | 2005 | 0-5 years | £0-5,taxable,zero-rate
I Can Pray Anywhere,'This book introduces the concept and practice of Prayer in Islam. At the same time, it points to the beauty and charms of landscape, so generously bestowed by Allah on the planet earth.','This book introduces the concept and practice of Prayer in Islam. At the same time, it points to the beauty and charms of landscape, so generously bestowed by Allah on the planet earth.',Children->Picture Books,50,4.95,4.95,4.95,0.32,,,,9780860373391,9780860373391.jpg,Aisha Ghani | The Islamic Foundation | I Can Series | 2004 | 0-5 years | £0-5,taxable,zero-rate
I Can Read The Quran (Almost)  Anywhere!,'This book focuses on the importance of studying the Qur''an in Islam. Its study makes us realise all the more the countless gifts of Allah to us. ','This book focuses on the importance of studying the Qur''an in Islam. Its study makes us realise all the more the countless gifts of Allah to us. ',Children->Picture Books,50,4.95,4.95,4.95,0.32,,,,9780860373094,9780860373094.jpg,Yasmin Ibrahim | The Islamic Foundation | I Can Series | 2004 | 0-5 years | £0-5,taxable,zero-rate
I Can Say Bismillah Anywhere,'I Can say Bismillah Anywhere!  instructs us  that we should remember Allah all the time, no matter what we do. Since Allah has created everything in the world, we should think of Him in all our actions. Includes 11 colour illustrations ','I Can say Bismillah Anywhere!  instructs us  that we should remember Allah all the time, no matter what we do. Since Allah has created everything in the world, we should think of Him in all our actions. Includes 11 colour illustrations ',Children->Picture Books,50,4.95,4.95,4.95,0.31,,,,9780860373148,9780860373148.jpg,Yasmin Ibrahim | The Islamic Foundation | I Can Series | 2005 | 0-5 years | £0-5,taxable,zero-rate
I Can Wear Hijab Anywhere,'This book explains that Hijab, which Islam prescribes for girls and women, is not some obstruction, preventing them from leading life in a natural way. While observing this norm a Muslim girl can participate in all activities. ','This book explains that Hijab, which Islam prescribes for girls and women, is not some obstruction, preventing them from leading life in a natural way. While observing this norm a Muslim girl can participate in all activities. ',Children->Picture Books,50,4.95,4.95,4.95,0.32,,,,9780860373193,9780860373193.jpg,Yasmin Ibrahim | The Islamic Foundation | I Can Series | 2004 | 0-5 years | £0-5,taxable,zero-rate
Ibrahim Khan and the Mystery of the Haunted Lake,'The second book in a series of adventures. Ibrahim and Zayn find themselves challenged by an unexpected mystery during a class vacation at the beautiful, remote Camp Chimo. How can they catch the culprit and prove that the ghost terrifying their classmates is a hoax?','The second book in a series of adventures. Ibrahim and Zayn find themselves challenged by an unexpected mystery during a class vacation at the beautiful, remote Camp Chimo. How can they catch the culprit and prove that the ghost terrifying their classmates is a hoax?',Children->Fiction->Children and Pre-Teen (7-11),50,3.5,3.5,3.5,0.3,,,,9780860374237,9780860374237.jpg,Farheen Khan | The Islamic Foundation | 2011 | 5-7 years | £0-5,taxable,zero-rate
'Image of the Prophet Muhammad in the West: A Study of Muir, Margoliouth and Watt','Brings out the main contours of Western scholarship on the life and achievements of the Prophet Muhammad (pbuh). Highlights the reason why Western scholars have failed to provide an objective account of the life of the Prophet in the past and brings into focus the urgent need to understand Islam and the life of the Prophet from an objective and scholarly perspective. "Jabal Muhammad Buaben''s work is an impressive scholarly enterprise… he has done much to reorient the path of Muslim scholarship''. Impact International','Brings out the main contours of Western scholarship on the life and achievements of the Prophet Muhammad (pbuh). Highlights the reason why Western scholars have failed to provide an objective account of the life of the Prophet in the past and brings into focus the urgent need to understand Islam and the life of the Prophet from an objective and scholarly perspective. "Jabal Muhammad Buaben''s work is an impressive scholarly enterprise… he has done much to reorient the path of Muslim scholarship''. Impact International',Books->Hadith & Seerah,50,22.5,22.5,22.5,0.65,,,,9780860372608,9780860372608.jpg,Jabal M Buaben | The Islamic Foundation | 1996 | £20+,taxable,zero-rate
'Image of the Prophet Muhammad in the West: A Study of Muir, Margoliouth and Watt','Brings out the main contours of Western scholarship on the life and achievements of the Prophet Muhammad (pbuh). Highlights the reason why Western scholars have failed to provide an objective account of the life of the Prophet in the past and brings into focus the urgent need to understand Islam and the life of the Prophet from an objective and scholarly perspective. "Jabal Muhammad Buaben''s work is an impressive scholarly enterprise… he has done much to reorient the path of Muslim scholarship''. Impact International','Brings out the main contours of Western scholarship on the life and achievements of the Prophet Muhammad (pbuh). Highlights the reason why Western scholars have failed to provide an objective account of the life of the Prophet in the past and brings into focus the urgent need to understand Islam and the life of the Prophet from an objective and scholarly perspective. "Jabal Muhammad Buaben''s work is an impressive scholarly enterprise… he has done much to reorient the path of Muslim scholarship''. Impact International',Books->Hadith & Seerah,50,13.95,13.95,13.95,0.54,,,,9780860372615,9780860372615.jpg,Jabal M Buaben | The Islamic Foundation | 1996 | £10-20,taxable,zero-rate
Imam Al-Ghazali: A Concise Life ,'Imam Abu Hamid Al-Ghazali is a towering figure in Islam today. But did you know that during his lifetime he was a scholar and a penniless wanderer? In this short biography you will discover how Al-Ghazali rose from his humble background as a fatherless young boy from a small town, to become a successful student, a great teacher and the most famous thinker on Islam of his time. It also reveals why, after years of success, he left behind his prestigious position and his family, and became a penniless traveller trying to experience the peace of a content inner life.   Award-winning author, Edoardo Albert, brings this most extraordinary of Muslims to life for a new generation, demonstrating his enduring influence and importance for Islamic civilization and the wider world. With numerous extracts from Al-Ghazalis own autobiography carefully rendered into contemporary English this book makes the man many consider to be one the most important Muslims in history accessible to all. Illustrated throughout with photographs, pictures and maps, the rich and diverse world that produced Al-Ghazali is also brought vividly alive.','Imam Abu Hamid Al-Ghazali is a towering figure in Islam today. But did you know that during his lifetime he was a scholar and a penniless wanderer? In this short biography you will discover how Al-Ghazali rose from his humble background as a fatherless young boy from a small town, to become a successful student, a great teacher and the most famous thinker on Islam of his time.',Children->Fiction->Young Adults (12+),50,4.99,4.99,4.99,0.36,,,,9781847740304,9781847740304.jpg,Edoardo Albert | The Islamic Foundation | 2012 | 12+ years | £0-5,taxable,zero-rate
In The Early Hours,'A collection of inspirational advice by a dear and beloved teacher, Ustadh Khurram Murad on the subject of spiritual and self development.','A collection of inspirational advice by a dear and beloved teacher, Ustadh Khurram Murad on the subject of spiritual and self development.',Books->Spirituality & Theology,50,4.5,4.5,4.5,0.31,,,,9780953676804,9780953676804.jpg,Khurram Murad | The Islamic Foundation | 2000 | £0-5,taxable,zero-rate
'In the Prophet''s Garden: A Selection of Ahadith for the young','A thematically arranged anthology of Ahadith, sayings of the Prophet Muhammad (peace and blessings be upon him), fully illustrated with colour pictures of flowers and pictures from nature. Each hadith is taken from authentic collections in Arabic followed by a simple modern English translation which make the book easy to read and easy to understand.  Appropriate for home, madrasa and classroom use.','A thematically arranged anthology of Ahadith, sayings of the Prophet Muhammad (peace and blessings be upon him), fully illustrated with colour pictures of flowers and pictures from nature. Each hadith is taken from authentic collections in Arabic followed by a simple modern English translation which make the book easy to read and easy to understand.  Appropriate for home, madrasa and classroom use.','Children->Islamic Studies->Qur''an & Hadith',50,8.95,8.95,8.95,0.44,,,,9780860373728,9780860373728.jpg,'Fatima M. D''Oyen | Abdelkader Chachi | 2002 | 9-11 years | £5-10',taxable,zero-rate
In the Shade of the Quran (set) INTERNATIONAL CUSTOMERS,'The Islamic Foundation is proud to announce the completion of this project, which has taken great time and effort to bring out.<br /><br />Sayyid Qutb (1906 - 1966). Literary critic, novelist, poet, Islamic thinker, and Egypt''s most famous Islamic activist of the 20th century. - Encyclopedia of the Modern Islamic World.</p>','The Islamic Foundation is proud to announce the completion of this project, which has taken great time and effort to bring out.<br /><br />Sayyid Qutb (1906 - 1966). Literary critic, novelist, poet, Islamic thinker, and Egypt''s most famous Islamic activist of the 20th century. - Encyclopedia of the Modern Islamic World.</p>','Books->Qur''an',50,185,185,185,12.5,,,,9780000000007,9780000000007.jpg,'Sayyid Qutb | The Islamic Foundation | In the Shade of the Qur''an tafsir | £20+',taxable,zero-rate
In the Shade of the Quran (set) UK CUSTOMERS ONLY,'The Islamic Foundation is proud to announce the completion of this project, which has taken great time and effort to bring out. Normal Price: £215. OFFER Price: £185 Plus Free Postage to UK customers.<br /><br />Sayyid Qutb (1906 - 1966). Literary critic, novelist, poet, Islamic thinker, and Egypts most famous Islamic activist of the 20th century. - Encyclopedia of the Modern Islamic World.<br /><br />Free Postage offer valid for UK Customers only</p>','The Islamic Foundation is proud to announce the completion of this project, which has taken great time and effort to bring out.<br /><br />Sayyid Qutb (1906 - 1966). Literary critic, novelist, poet, Islamic thinker, and Egypt''s most famous Islamic activist of the 20th century. - Encyclopedia of the Modern Islamic World.</p>','Books->Qur''an',50,185,185,185,0,,,,9780000000007,9780000000007.jpg,'Sayyid Qutb | The Islamic Foundation | In the Shade of the Qur''an tafsir | £20+',taxable,zero-rate
In The Shade Of The Quran Volume 1 ,'Surahs 1 & 2, Al-Fatiha and Al-Baqarah','Surahs 1 & 2, Al-Fatiha and Al-Baqarah','Books->Qur''an',50,11.95,11.95,11.95,0.9,,,,9780860373971,9780860373971.jpg,'Sayyid Qutb | The Islamic Foundation | In the Shade of the Qur''an tafsir | 2003 | £10-20',taxable,zero-rate
In The Shade Of The Quran Volume 10,'Surahs 12 - 15, Yusuf - Al-Hijr','Surahs 12 - 15, Yusuf - Al-Hijr','Books->Qur''an',50,17.95,17.95,17.95,0.72,,,,9780860373896,9780860373896.jpg,'Sayyid Qutb | The Islamic Foundation | In the Shade of the Qur''an tafsir | 2004 | £10-20',taxable,zero-rate
