title,description,short_description,Category,stock,price,regular_price,sales_price,weight,length,width,height,sku,picture,tags,tax_status,tax_class
A Caring Neighbour,'A lovely story which illustrates for young children the importance of helping one''s neighbour. Full colour illustrations.','A lovely story which illustrates for young children the importance of helping one''s neighbour. Full colour illustrations.',Children->Picture Books,50,1.95,1.95,1.95,0.06,,,,9780860372653,9780860372653.jpg,Karema Bouroubi | The Islamic Foundation | 1996 | 0-5 years | £0-5,taxable,zero-rate
A Course in Ilm Al-Tajwid:The Science of Reciting the Quran,'The first teaching manual of its kind in English, accompanied by 3CDs ;recited by Al-Shaykh Sayyid Karrar from Egypt.Key Features-  17 Units explain the most important themes; and 75 rules make recitation clear and easy, Extensive practice texts from the Quran in Arabic, Over 1000 Quranic references; 3 hours of audio for the practice texts for all 75 rules; Includes an introduction to Ilm al-Tajwid, biographies of prominent reciters, diagrams, illustrations and tables, making recitation easy.','The first teaching manual of its kind in English, accompanied by 3CDs ;recited by Al-Shaykh Sayyid Karrar from Egypt.Key Features-  17 Units explain the most important themes; and 75 rules make recitation clear and easy, ','Books->Qur''an',50,22.95,22.95,22.95,0.39,,,,9780860371854,9780860371854.jpg,Muhammad I. H. I Surty | The Islamic Foundation | 1988 | £20+,taxable,zero-rate
A Drop of Mercy (Book & Poster),'A Drop of Mercy: The Water Cycle draws the attention of young inquisitive minds to one of the great blessings of Allah; Water which has numerous uses for us. It traces in a simple and easy to understand language scientific information, the journey of Water; how it originates and passes through several phases before it reaches us for meeting our needs. The book includes some recommended activities which are beneficial for class situations. It is also accompanied by a WALL POSTER designed to show the water cycle in greater detail. Includes 17 colour illustrations.',A Drop of Mercy: The Water Cycle draws the attention of young inquisitive minds to one of the great blessings of Allah. Includes a WALL POSTER designed to show the water cycle in greater detail. Includes 17 colour illustrations.,Children->Picture Books,50,4.95,4.95,4.95,0.5,,,,9780860373834,9780860373834.jpg,Shahbatun Abu Bakar |  Nordin Endut | The Islamic Foundation |2004 | 5-7 years | £0-5,taxable,zero-rate
A Great Friend of Children,Eight stories which show the great degree of love and kindness which the Prophet (pbuh) showed to children.,Eight stories which show the great degree of love and kindness which the Prophet (pbuh) showed to children.,'Children->The Prophet''s Biography',50,3.95,3.95,3.95,0.27,,,,9780860374329,9780860374329.jpg,M.S. Kayani | The Islamic Foundation | 2008 | 5-7 years | £0-5,taxable,zero-rate
A Journey Through Islamic History: A Timeline of Key Events ,'A Journey through Islamic History tells you all you ever wanted to know about the history of the Muslim world from the Prophet Muhammad to Malcolm X in a short, accessible and lavishly-illustrated format.  Suitable for students of all ages. Includes Seven chronological essays covering 1500 years of history. With over 175 pictures, illustrations and maps. A comprehensive timeline with over 500 entries. Textboxes featuring important personalities, key events and major ideas.A must for every library, college, school and home.','A Journey through Islamic History tells you all you ever wanted to know about the history of the Muslim world from the Prophet Muhammad to Malcolm X in a short, accessible and lavishly-illustrated format.  Includes Seven chronological essays covering 1500 years of history. With over 175 pictures, illustrations and maps.',Books->History,50,18.99,18.99,18.99,1.2,,,,9781847740281,9781847740281.jpg,Yasminah Hashim | M. Abdul Jabbar Beg | Kube Publishing | 2012 | £10-20,taxable,zero-rate
'A Picnic of Poems: In Allah''s Green Garden Book +CD','A wonderful collection of 30 poems to keep the young and young at heart entertained for hours. These poems cover a number of topics including: Motherhood, Daily Prayers, Baby siblings, Life on a farm, the animal kingdom, Bullying, Ramadan, Mosques, appreciating nature and more. This book comes with an audio CD  to sing along to these joyful yet educational poems. This book is a must for every household, a great contribution by Dawud Wharnsby.  "Dawud''s latest book is another masterpeice of poetry that captures the essence of every child''s thoughts, hopes, dreams and fears, in the most colourful and imaginative way. It is a delectable treat for the whole family, filled with beautiful illustrations. Every part has a wonderful lesson to draw from and will provide all, young and old, with great guidance for generations to come." - Zain Bhika, South African, singer/songwriter','A wonderful collection of 30 poems to keep the young and young at heart entertained for hours. These poems cover a number of topics including: Motherhood, Daily Prayers, Baby siblings, Life on a farm, the animal kingdom, Bullying, Ramadan, Mosques, appreciating nature and more. This book comes with an audio CD  to sing along to these joyful yet educational poems. ',Children->Poetry & Anthologies,50,9.99,9.99,9.99,0.55,,,,9780860374442,9780860374442.jpg,Dawud Wharnsby | The Islamic Foundation | 2011 | 5-7 years | £5-10,taxable,zero-rate
A Prayer at Bedtime,'Tigers, giant waves and other fears haunt little Abdullah. A fascinating and imaginative story of how a family help their little boy to overcome frightening dreams and nightmares through the power of prayer.','Tigers, giant waves and other fears haunt little Abdullah. A fascinating and imaginative story of how a family help their little boy to overcome frightening dreams and nightmares through the power of prayer.',Children->Picture Books,50,3.95,3.95,3.95,0.28,,,,9780860375609,9780860375609.jpg,Zaynab Dawood | The Islamic Foundation | 2006 | 5-7 years | £0-5,taxable,zero-rate
A Princess`s Pilgrimage,'A Princess Pilgrimage - A Pilgrimage to Mecca (1863-1864) In 1870, Nawab Sikander Begum of Bhopal became the first South-Asian Muslim woman to publish an account of her pilgrimage to Mecca. She travelled with a retinue of a thousand, visited Jeddah and Mecca, performed the requisite rituals and observances, then returned to India and wrote her witty and acerbic impressions of her visit. Reproduced here,this is the original English translation by the wife of a British colonial officer of an unpublished Urdu manuscript. It is accompanied by a critical Introduction and Afterword that make this offering a comprehensive resource on travel writing by South-Asian Muslim women, and encourage the reader- whether scholar, student or enthusiast - to rethink established understandings relating to travel writing colonialism and world history.','A Princess Pilgrimage - A Pilgrimage to Mecca (1863-1864) In 1870, Nawab Sikander Begum of Bhopal became the first South-Asian Muslim woman to publish an account of her pilgrimage to Mecca. She travelled with a retinue of a thousand, visited Jeddah and Mecca, performed the requisite rituals and observances, then returned to India and wrote her witty and acerbic impressions of her visit.',Books->Islam in General,50,9.95,9.95,9.95,0.32,,,,9781847740014,9781847740014.jpg,Begum Nawab Sikandar | Kube Publishing | 2007 | £5-10,taxable,zero-rate
A School Girls Hero,'For a couple of days the same question continued puzzling Anum; "Who do I aspire to be like?" Then, whilst she was busy helping her mum with chores it suddenly came to her. It now seemed so obvious, and she couldn''t believe it hadn''t come to her earlier. She told her family about her idea and they were all really impressed. but Anum then began having second thoughts... ','For a couple of days the same question continued puzzling Anum; "Who do I aspire to be like?" Then, whilst she was busy helping her mum with chores it suddenly came to her. It now seemed so obvious, and she couldn''t believe it hadn''t come to her earlier. She told her family about her idea and they were all really impressed. but Anum then began having second thoughts... ',Children->Fiction->Children and Pre-Teen (7-11),50,3.95,3.95,3.95,0.17,,,,9780860374213,9780860374213.jpg,Umm Aamina | The Islamic Foundation | 2007 | 7-9 years | £0-5,taxable,zero-rate
A Simple Guide to Prayer ,'Accompanied by a CD, this book has been prepared to assist you in your first steps towards learning and performing Salah, prayer in Islam. You are introduced to the concept of Prayer in Islam and its Divine origins through Prophets Abraham, Moses, Jesus and Muhammad, peace be upon them all. ','Accompanied by a CD, this book has been prepared to assist you in your first steps towards learning and performing Salah, prayer in Islam. You are introduced to the concept of Prayer in Islam and its Divine origins through Prophets Abraham, Moses, Jesus and Muhammad, peace be upon them all. ',Books->Spirituality & Theology,50,4.95,4.95,4.95,0.18,,,,9780860374862,9780860374862.jpg,Batool Al-Toma | The Islamic Foundation | 2005 | £0-5,taxable,zero-rate
A Simple Guide to Prayer (CD),'This CD will assist towards understanding the meaning of Prayer, its form and significance as well as learning how to perform it. Arabic read by Abdur Rahim Scott, Saukani Amron, Ismail Hewitt and Abdul Jabbar Al-Toma. English by Ibrahim Hewitt and Batool Al-Toma.','This CD will assist towards understanding the meaning of Prayer, its form and significance as well as learning how to perform it. Arabic read by Abdur Rahim Scott, Saukani Amron, Ismail Hewitt and Abdul Jabbar Al-Toma. English by Ibrahim Hewitt and Batool Al-Toma.','Children->Audio, Poster, Other',50,4.21,4.21,4.21,0.05,,,,9780000000006,9780000000006.jpg,Batool Al-Toma | The Islamic Foundation | 2005 | £0-5,taxable,zero-rate
A Textbook of Hadith Studies,'A Textbook of Hadith Studies is an authoritative book on Hadith criticism, classification, compilation and authenticity. It provides a wide-ranging coverage of Hadith methodology and literature for intermediate and advanced levels of study. Readership: For all those interested in Hadith, Islamic law, History and classical Islamic intellectual tradition.','A Textbook of Hadith Studies is an authoritative book on Hadith criticism, classification, compilation and authenticity. It provides a wide-ranging coverage of Hadith methodology and literature for intermediate and advanced levels of study. Readership: For all those interested in Hadith, Islamic law, History and classical Islamic intellectual tradition.',Books->Hadith & Seerah,50,8.95,8.95,8.95,0.43,,,,9780860374350,9780860374350.jpg,Mohammad Hashim Kamali | The Islamic Foundation | 2005 | £5-10,taxable,zero-rate
A Time to Speak: Anecdotes from Sadi Shirazi,'Classic fables and moral tales of the Persian master of verse, representing the wisdom of the East and the values of Muslim culture.','Classic fables and moral tales of the Persian master of verse, representing the wisdom of the East and the values of Muslim culture.',Children->Islamic Studies,50,1.95,1.95,1.95,0.06,,,,9780950395432,9780950395432.jpg,Ashraf abu Turab | Zia Sardar | The Islamic Foundation | 1980 | 7-9 years| £0-5,taxable,zero-rate
A Trust of Treasures,'<p>Here is a tale of praise and gratitude, <br />To the Power of the One, <br />Who created the magnificent riches of the earth and the skies and then, <br />Like a hidden treasure wanting to be known, <br />Created us. <br />And it is we alone among all creatures <br />Who can reflect, <br />And accept stewardship, <br />And bow down in love and awe.<br />&nbsp;<br />A world waiting to be discovered, enjoyed and respected, but too often taken for granted; <br /><br />Beautifully written, discover our relationship with the treasures of this world!','<p>Here is a tale of praise and gratitude, <br />To the Power of the One, <br />Who created the magnificent riches of the earth and the skies and then, <br />Like a hidden treasure wanting to be known, <br />Created us. <br />And it is we alone among all creatures <br />Who can reflect, <br />And accept stewardship, <br />And bow down in love and awe.',Children->Islamic Studies,50,5.95,5.95,5.95,0.41,,,,9780860374626,9780860374626.jpg,Mehded Maryam Sinclair | The Islamic Foundation | 2009 | 7-9 years | £5-10,taxable,zero-rate
Abu Bakr: The First Caliph,'A brief biography of this prominent and beloved Companion of the Prophet Muhammad and first Caliph after the Prophet''s death. ','A brief biography of this prominent and beloved Companion of the Prophet Muhammad and first Caliph after the Prophet''s death. ',Children->Fiction->Young Adults (12+),50,2.25,2.25,2.25,0.07,,,,9780950395449,9780950395449.jpg,Muhammad Rashid Feroze | The Islamic Foundation | 1982 | 12+ years | £0-5,taxable,zero-rate
'Abu Hanifah - His Life, Legal Method and Legacy','Abu Hanifah, Numan ibn Thabit (d. 150/767) is one of the great pioneers in the history of Islamic Law. He was among the first to deploy the recognized methods of legal reasoning consistently, and to gather the judgements and rulings of his time into a systematic corpus. The fiqh that evolved from his style of reasoning, carried on by his brilliant students, became associated with his name. The Hanafi school is the one most widely followed among the worlds Sunni Muslims. This study of Abu Hanifahs life and legacy is based on the traditional sources. It includes a short survey of how Hanafi fiqh evolved in different regions of the Islamic world. It offers a clear reminder of the criteria and conditions traditionally applied before any ruling gained general acceptance. Mohammed Akram Nadwi, former student then teacher of Hanafi and Shafii law at the prestigious Nadwat al-Ulama (Lucknow, India), is currently a Research Fellow at the Oxford Centre for Islamic Studies. He is the author (in Arabic) of several biographies, and editions and translations of classical hadith and fiqh works. His most recent publications in English are a multi-volume primer of Hanafi fiqh, al-Fiqh al-Islami, (2007), and al-Muhaddithat: the Women Scholars in Islam (2007).','Abu Hanifah, Numan ibn Thabit (d. 150/767) is one of the great pioneers in the history of Islamic Law. He was among the first to deploy the recognized methods of legal reasoning consistently, and to gather the judgements and rulings of his time into a systematic corpus. The fiqh that evolved from his style of reasoning, carried on by his brilliant students, became associated with his name. The Hanafi school is the one most widely followed among the worlds Sunni Muslims. This study of Abu Hanifahs life and legacy is based on the traditional sources.',Books->History,50,6.99,6.99,6.99,0.3,,,,9781847740175,9781847740175.jpg,Mohammad Akram Nadwi | Kube Publishing | 2011 | £5-10,taxable,zero-rate
Adventures in the Nile Valley,'During a young British Muslim boy''s second visit to Egypt he discovers the wonders of the pyramids, Al-Azhar and other attractions. Full-colour illustrations.','During a young British Muslim boy''s second visit to Egypt he discovers the wonders of the pyramids, Al-Azhar and other attractions. Full-colour illustrations.',Children->Fiction->Children and Pre-Teen (7-11),50,3.95,3.95,3.95,0.12,,,,9780860372424,9780860372424.jpg,Susan Omar | The Islamic Foundation | 1994 | 9-11 years | £0-5,taxable,zero-rate
Against Smoking. An Ottoman Manifesto,'Ottomans initiated the West to the pleasures of opium, coffee and tulips. For their reward, they got literally smoked by Europeans, who started exporting tobacco to Turkey in the early 1600. This book is the first English language translation  of the original Arabic critical edition, presented in a scholarly edition, with  arguments drawn on the Quran, hadith, medicine and distrust towards the West. ','Ottomans initiated the West to the pleasures of opium, coffee and tulips. For their reward, they got literally smoked by Europeans, who started exporting tobacco to Turkey in the early 1600. This book is the first English language translation  of the original Arabic critical edition, presented in a scholarly edition, with  arguments drawn on the Quran, hadith, medicine and distrust towards the West. ',Books->History,50,7.99,7.99,7.99,0.38,,,,9781847740205,9781847740205.jpg,Ahmad Al-aqhisari | Editor Yahya Michot | 2008 | £5-10,taxable,zero-rate
Aisha Goes in Search of Colour,'Bubblesville is the capital of Nectarland. It is known to be the most colourful place in the whole world. It is home to the world''s most special and unusual insects. Aisha is one of them! Come and discover how Aisha learns to live with being different in this charming tale set amongst the world of insects.','Bubblesville is the capital of Nectarland. It is known to be the most colourful place in the whole world. It is home to the world''s most special and unusual insects. Aisha is one of them! Come and discover how Aisha learns to live with being different in this charming tale set amongst the world of insects.',Children->Picture Books,50,3.95,3.95,3.95,0.29,,,,9780860374725,9780860374725.jpg,Lisa Dhar | The Islamic Foundation | 2008 | 0-5 years | £0-5,taxable,zero-rate
Ali and the Spider,Ali learns to overcome his fear of spiders when he learns how a humble spider helped to save the life of the beloved Prophet Muhammad (Pbuh).,Ali learns to overcome his fear of spiders when he learns how a humble spider helped to save the life of the beloved Prophet Muhammad (Pbuh).,Children->Picture Books,50,3.95,3.95,3.95,0.24,,,,9780860373254,9780860373254.jpg,Rawaa El-Magazy | The Islamic Foundation | 2000 | 5-7 years | £0-5,taxable,zero-rate
Allah Gave Me a Nose To Smell,'A wonderful account of the sense of smell given to us by Allah, which can be explored endlessly with young children through everyday smells and fragrances, encouraging us to give thanks to our Creator. Includes 14 colour illustrations','A wonderful account of the sense of smell given to us by Allah, which can be explored endlessly with young children through everyday smells and fragrances, encouraging us to give thanks to our Creator. Includes 14 colour illustrations',Children->Picture Books,50,3.95,3.95,3.95,0.28,,,,9780860373339,9780860373339.jpg,Rizwana Qamaruddin | The Islamic Foundation | Allah the Maker Series | 2003 | 0-5 years | £0-5,taxable,zero-rate
Allah Gave Me a Tongue To Taste,'A wonderful account of the sense of taste given to us by Allah, which can be explored endlessly with young children through popular food tastes, encouraging them to give thanks to our Creator. Includes 12 colour illustrations','A wonderful account of the sense of taste given to us by Allah, which can be explored endlessly with young children through popular food tastes, encouraging them to give thanks to our Creator. Includes 12 colour illustrations',Children->Picture Books,50,3.95,3.95,3.95,0.28,,,,9780860373384,9780860373384.jpg,Ayesha Jones | The Islamic Foundation | Allah the Maker Series | 2003 | 0-5 years | £0-5,taxable,zero-rate
Allah Gave Me Two Ears To Hear,'A wonderful account of the sense of hearing given to us by Allah, which can be explored endlessly with young, encouraging them to give thanks to our Creator. Includes 16 colour illustrators','A wonderful account of the sense of hearing given to us by Allah, which can be explored endlessly with young, encouraging them to give thanks to our Creator. Includes 16 colour illustrators',Children->Picture Books,50,3.95,3.95,3.95,0.28,,,,9780860373537,9780860373537.jpg,Amrana Arif | The Islamic Foundation | Allah the Maker Series | 2003 | 0-5 years | £0-5,taxable,zero-rate
Allah Gave Me Two Eyes To See,'The wonders of all of our senses are introduced to children in simple rhyme, along with the most important gift of all, a heart with which to love and give thanks to God. ','The wonders of all of our senses are introduced to children in simple rhyme, along with the most important gift of all, a heart with which to love and give thanks to God. ',Children->Picture Books,50,3.95,3.95,3.95,0.28,,,,9780860373667,9780860373667.jpg,'Fatima M. D''Oyen | The Islamic Foundation | Allah the Maker Series | 2002 | 0-5 years | £0-5',taxable,zero-rate
Allah Gave Me Two Hands and Feet,'A wonderful account of the sense of touch given to us by Allah, which can be explored endlessly with young children, encouraging them to give thanks to our Creator. Includes 12 colour illustrations','A wonderful account of the sense of smell given to us by Allah, which can be explored endlessly with young children through everyday smells and fragrances, encouraging us to give thanks to our Creator. Includes 14 colour illustrations',Children->Picture Books,50,3.95,3.95,3.95,0.28,,,,9780860373483,9780860373483.jpg,Raana Bokhari | The Islamic Foundation | Allah the Maker Series | 2003 |0-5 years | £0-5,taxable,zero-rate
Amiras Totally Chocolate World,'Amira loves chocolate so much that every night before she goes to sleep, she asks Allah to make everything chocolate. On Eid ul-Fitr, she wakes up to find a totally chocolate world!  Chocolate.  undeniably irresistible, and in one form or another adored by many. If you appreciate the value of chocolate then join Amira in her Totally Chocolate World <p>Review</p>  <p>"...This is a story that is just right for new readers, with steady text and just enough repitition. Make sure you have some chocolate on hand-the story and illustrations just might make readers hungry." Teresa Scollon, ForeWord Reviews, May/June 2010</p>','Amira loves chocolate so much that every night before she goes to sleep, she asks Allah to make everything chocolate. On Eid ul-Fitr, she wakes up to find a totally chocolate world! Discover the joys of living in a chocolate world…..and is it really that great! ',Children->Picture Books,50,3.95,3.95,3.95,0.29,,,,9780860374084,9780860374084.jpg,J. S. Mair | The Islamic Foundation | 2009 | 0-5 years | £0-5,taxable,zero-rate
An Islamic Game of Snakes & Ladders for Children (Revised 2011),'This game is suitable for children over five years of age. It teaches children the difference between right and wrong, and that they gain rewards for doing good deeds. Please note the board is made from gloss laminated card and comes in a tube with dice and counters. 2 - 6 players','This game is suitable for children over five years of age. It teaches children the difference between right and wrong, and that they gain rewards for doing good deeds. Please note the board is made from gloss laminated card and comes in a tube with dice and counters. 2 - 6 players','Children->Audio, Poster, Other',50,3.29,3.29,3.29,0.13,,,,9780000000002,9780000000002.jpg,The Islamic Foundation | The Islamic Foundation | 2011 | 5-7 years | £0-5,taxable,zero-rate
Animal Welfare in Islam,'This book attempts to bring out the kind and compassionate Islamic teachings regarding animal welfare. The Islamic instruction and guidance on animals needs and man''s obligations concerning animals is so comprehensive that Muslims need not go elsewhere for any guidance. Not to be cruel or even to be condescendingly kind to the so-called inferior animals is a negative proposition. Islam wants its adherents to think and act in the positive terms of accepting all species as communities like us in their own right and not to sit in judgement on them according to our human norms and values. The book also examines animal sacrifice as practised by the adherents of major world religions. It raises the issue of the mass production of meat and exhorts the Muslim community, in the West particularly, to tackle the issue of Halal meat in an appropriate manner.','This book attempts to bring out the kind and compassionate Islamic teachings regarding animal welfare. The Islamic instruction and guidance on animals needs and man''s obligations concerning animals is so comprehensive that Muslims need not go elsewhere for any guidance. Not to be cruel or even to be condescendingly kind to the so-called inferior animals is a negative proposition.',Books->Islam in General,50,9.95,9.95,9.95,0.24,,,,9780860375951,9780860375951.jpg,Al-Hafiz Basheer Ahmad Masri | The Islamic Foundation | 2007 | £5-10,taxable,zero-rate
Animal Welfare in Islam,'This book attempts to bring out the kind and compassionate Islamic teachings regarding animal welfare. The Islamic instruction and guidance on animals needs and man''s obligations concerning animals is so comprehensive that Muslims need not go elsewhere for any guidance. Not to be cruel or even to be condescendingly kind to the so-called inferior animals is a negative proposition. Islam wants its adherents to think and act in the positive terms of accepting all species as communities like us in their own right and not to sit in judgement on them according to our human norms and values. The book also examines animal sacrifice as practised by the adherents of major world religions. It raises the issue of the mass production of meat and exhorts the Muslim community, in the West particularly, to tackle the issue of Halal meat in an appropriate manner.','This book attempts to bring out the kind and compassionate Islamic teachings regarding animal welfare. The Islamic instruction and guidance on animals needs and man''s obligations concerning animals is so comprehensive that Muslims need not go elsewhere for any guidance. Not to be cruel or even to be condescendingly kind to the so-called inferior animals is a negative proposition.',Books->Islam in General,50,15.95,15.95,15.95,0.36,,,,9780860374114,9780860374114.jpg,Al-Hafiz Basheer Ahmad Masri | The Islamic Foundation | 2007 | £10-20,taxable,zero-rate
