title,description,short_description,Category,stock,price,regular_price,sales_price,weight,length,width,height,sku,picture,tags,tax_status,tax_class
Islamic Manners Activity Book ,'Learn a selection of Arabic prayers and expressions while having fun! 60+ pages of imaginative activities, puzzles, word searches, colouring pages, dot-to-dots and matching cards that will occupy and entertain children for hours.','Learn a selection of Arabic prayers and expressions while having fun! 60+ pages of imaginative activities, puzzles, word searches, colouring pages, dot-to-dots and matching cards that will occupy and entertain children for hours.',Children->Islamic Studies,50,2.99,2.99,2.99,0.23,,,,9780860374633,9780860374633.jpg,The Islamic Foundation | The Islamic Foundation | 2011 | 5-7 years | £0-5,taxable,zero-rate
Islamic Manners Poster (set of 2),'Set of 2 posters, colourfully illustrating 16 scenarios to understand and learn Islamic Manners. First in our series of Islamic Manners products.','Set of 2 posters, colourfully illustrating 16 scenarios to understand and learn Islamic Manners. First in our series of Islamic Manners products.','Children->Audio, Poster, Other',50,4.25,4.25,4.25,0.3,,,,9780000000003,9780000000003.jpg,The Islamic Foundation | The Islamic Foundation | 2009 | 0-5 years | £0-5,taxable,zero-rate
Journey to Islam,'Rich in remarkable and thought-provoking events, including compelling encounters with Islamic philosophy, led Mr. Hofmann to embrace Islam. His diary is a lively introduction to Islam, developed in the spiritual confrontation of a Muslim intellectual of European background with the idealogy and value system of post-industrial Western society. ','Rich in remarkable and thought-provoking events, including compelling encounters with Islamic philosophy, led Mr. Hofmann to embrace Islam. His diary is a lively introduction to Islam, developed in the spiritual confrontation of a Muslim intellectual of European background with the idealogy and value system of post-industrial Western society. ',Books->Islam in General,50,5.95,5.95,5.95,0.28,,,,9780860373261,9780860373261.jpg,Murad Wilfried Hofmann | The Islamic Foundation | 2001 | £5-10,taxable,zero-rate
Justice: Islamic and Western Perspectives,'Justice: Islamic and Western Perspectives. Meant for the general reader, this book gives a historical expose of the Western definitions of justice - mainly economic and social justice - from Plato to the modern day and compares it with the Islamic concept of justice. He draws upon the fundamental and central concepts of the Quran to the permanence and universality of that concept. He shows that the combination of adl (justice), qist (equity) and mizan (balance) goes towards creating that notion in comparison to the shifting definition of the Western conception which depends on which ideology is dominant.','Justice: Islamic and Western Perspectives. Meant for the general reader, this book gives a historical expose of the Western definitions of justice - mainly economic and social justice - from Plato to the modern day and compares it with the Islamic concept of justice.',Books->Islam in General,50,4.95,4.95,4.95,0.12,,,,9780860375906,9780860375906.jpg,Zafar Iqbal | The Islamic Foundation | 2007 | £0-5,taxable,zero-rate
Key To Al Baqarah: The Longest Surah of the Quran,'A short guide to understanding the contents and major themes of the longest Surah of the Quran. Al-Baqarahis important because it defines the meaning, mission and identity of the Muslim Ummah.','A short guide to understanding the contents and major themes of the longest Surah of the Quran. Al-Baqarahis important because it defines the meaning, mission and identity of the Muslim Ummah.','Books->Qur''an',50,1.95,1.95,1.95,0.07,,,,9780860372707,9780860372707.jpg,Khurram Murad | The Islamic Foundation | 1996 | £0-5,taxable,zero-rate
Key To Al Fatiha: Understanding the Basic Concepts, Key To Al Fatiha, Key To Al Fatiha,'Books->Qur''an',50,2.95,2.95,2.95,0.1,,,,9780860373612,9780860373612.jpg,Abdur Rashid Siddiqui | The Islamic Foundation | 2001 | £0-5,taxable,zero-rate
Key To Al Imran: Resurgence of the Ummah,'Based on valuable material from authentic tafasir in Arabic and Urdu, the book provides a thematic study of Surah Al-Imran. A commendable work, meeting the mindset and intellectual needs of the English-speaking young generation of Muslims in the West.','Based on valuable material from authentic tafasir in Arabic and Urdu, the book provides a thematic study of Surah Al-Imran. A commendable work, meeting the mindset and intellectual needs of the English-speaking young generation of Muslims in the West.','Books->Qur''an',50,2.5,2.5,2.5,0.08,,,,9780860373865,9780860373865.jpg,Abdur Rashid Siddiqui | The Islamic Foundation | 2002 | £0-5,taxable,zero-rate
Key to Al-Kahf. Challenging Materialism and Godlessness,'Surah al-Kahf (chapter of the Cave) comes exactly midway through the Quran, and covers four historical events and two parables. As many ahadith encourage the memorization and recitation of this surah, either in whole or part on Fridays as protection against Dajjal (the Anti-Christ), it is essential to understand this surah and to implemement the antidote provided therein. It includes a brief note on the phenomenon of Dajjal based on authentic ahadith. Based on a seminar paper presented by Khurram Murad in the 1980s, this concise presentation clarifies the dynamic ideas portrayed in the majestic Quran through an examination of Surah al-kahf. Abdur Rashid Siddiqui has edited the text and completed those sections that were not in the original paper. The authors have concentrated on the message that the Quran expounds from various episodes narrated in this surah.','Surah al-Kahf (chapter of the Cave) comes exactly midway through the Quran, and covers four historical events and two parables. As many ahadith encourage the memorization and recitation of this surah, either in whole or part on Fridays as protection against Dajjal (the Anti-Christ), it is essential to understand this surah and to implemement the antidote provided therein','Books->Qur''an',50,3.75,3.75,3.75,0.11,,,,9780860374534,9780860374534.jpg,Khurram Murad | Abdur Rashid Siddiqui | The Islamic Foundation |2011 | £0-5,taxable,zero-rate
Let Us Be Muslims,'This is a new revised and edited edition of Sayyid Mawdudi''s Urdu Khutubat which cover themes such as Iman, Islam, the Prayer, Fasting, Almsgiving, Pilgrimage and Jihad.','This is a new revised and edited edition of Sayyid Mawdudi''s Urdu Khutubat which cover themes such as Iman, Islam, the Prayer, Fasting, Almsgiving, Pilgrimage and Jihad.',Books->Islam in General,50,7.95,7.95,7.95,0.41,,,,9780860371571,9780860371571.jpg,'Abul A''la Mawdudi | The Islamic Foundation | 1985 | £5-10',taxable,zero-rate
Lift Up Your Hearts: A Collection of 25 Khutbah for Prayer (Vol.2),'This volume covers many moral and social issues from an islamic perspective as well as some of the problems faced by the Muslim community in the west. Topics discussed include: Justice, Death and Disaster, Sports and leisure, Care for the environment and homesexuality. ','This volume covers many moral and social issues from an islamic perspective as well as some of the problems faced by the Muslim community in the west. Topics discussed include: Justice, Death and Disaster, Sports and leisure, Care for the environment and homesexuality. ',Books->Islam in General,50,4.95,4.95,4.95,0.25,,,,9780860374305,9780860374305.jpg,Abdur Rashid Siddiqui | The Islamic Foundation | 2005| £0-5,taxable,zero-rate
Lift Up Your Hearts: A Collection of 30 Khutbah for Friday Prayer Vol 1,'Based on the author''s khutbahs delivered at Friday congregations at the Islamic Society, University of Leicester. Covers themes like: Ilm (Knowledge), Islam, >Iman (Faith), Akhirah (the Hereafter), Sacrifice, Dawah and many more. A practical guide for Islamic Societies. ','Based on the author''s khutbahs delivered at Friday congregations at the Islamic Society, University of Leicester. Covers themes like: Ilm (Knowledge), Islam, >Iman (Faith), Akhirah (the Hereafter), Sacrifice, Dawah and many more. A practical guide for Islamic Societies. ',Books->Islam in General,50,4.95,4.95,4.95,0.3,,,,9780860373568,9780860373568.jpg,Abdur Rashid Siddiqui | The Islamic Foundation | 2001| £0-5,taxable,zero-rate
Love at Home,Eleven charming stories which highlight the mutual love and respect which should characterise family life. Full-colour illustrations.,Eleven charming stories which highlight the mutual love and respect which should characterise family life. Full-colour illustrations.,Children->Non Fiction->Islamic History,50,2.25,2.25,2.25,0.11,,,,9780860371229,9780860371229.jpg,Khurram Murad | The Islamic Foundation | 1983 | 7-9 years | £0-5,taxable,zero-rate
'Love Your Brother, Love Your Neighbour ','Six inspiring accounts, based on true stories, that demonstrate the value of love, sacrifice, respect, charity, compassion and kindness to all people.','Six inspiring accounts, based on true stories, that demonstrate the value of love, sacrifice, respect, charity, compassion and kindness to all people.',Children->Non Fiction->Islamic History,50,2.25,2.25,2.25,0.07,,,,9780860371151,9780860371151.jpg,Khurram Murad | The Islamic Foundation | 1982 | 7-9 years | £0-5,taxable,zero-rate
Man & Destiny:Some Reflections on Iqbals Concept of Khudi & the Perfect Man,'Man and Destiny:Some Reflections on Iqbals Concept of Khudi and the Perfect Man.  Contemporary Islamic resurgence can be understood in its historical perspective and ideological connotations only by having a deeper understanding of the thoughts and contributions of its chief architects, among whom Iqbal, one of the most illustrious poet-philosophers of Islam occupies a very distinct position. Abdur Rashid Siddiqui''s well-researched book is a timely contribution that brings into sharp focus the real intellectual and ideological ethos of Islamic resurgence. He has delved deep into the mind and soul of Iqbal and presented in a simple and lucid style two cardinal concepts of Iqbalian thought. The concepts of Khudi (self) and Insan-i-Kamil (the perfect man) are keys to the understanding of Iqbals vision of man and his role in history.','Man and Destiny:Some Reflections on Iqbals Concept of Khudi and the Perfect Man.  Contemporary Islamic resurgence can be understood in its historical perspective and ideological connotations only by having a deeper understanding of the thoughts and contributions of its chief architects, among whom Iqbal, one of the most illustrious poet-philosophers of Islam occupies a very distinct position. Abdur Rashid Siddiqui''s well-researched book is a timely contribution that brings into sharp focus the real intellectual and ideological ethos of Islamic resurgence. He has delved deep into the mind and soul of Iqbal and presented in a simple and lucid style two cardinal concepts of Iqbalian thought. The concepts of Khudi (self) and Insan-i-Kamil (the perfect man) are keys to the understanding of Iqbals vision of man and his role in history.',Books->Islam in General,50,9.99,9.99,9.99,0.23,,,,9780860374718,9780860374718.jpg,Abdur Rashid Siddiqui | The Islamic Foundation | 2007 | £5-10,taxable,zero-rate
Marvellous Stories from the Life of Muhammad,'A lively account of memorable events in the Prophet''s life, beautifully told. "These tales... are a delight to read, giving imaginative vitality to the bare facts so often related in other accounts of the Prophet''s life".','A lively account of memorable events in the Prophet''s life, beautifully told. "These tales... are a delight to read, giving imaginative vitality to the bare facts so often related in other accounts of the Prophet''s life".','Children->The Prophet''s Biography',50,3.95,3.95,3.95,0.17,,,,9780860471038,9780860471038.jpg,Mardijah Aldrich Tarantino | The Islamic Foundation | 1982 | 7-9 years | £0-5,taxable,zero-rate
Maryam and the Trees,Maryam and Abdullah learn from their mother about the benefits of the trees which are alive and important for the welfare of our environment. Discover all other benefits of trees and nature. Share the excitement which Maryam and Abdullah experience in planting and growing their first seed. Includes 19 colour illustrations,Maryam and Abdullah learn from their mother about the benefits of the trees which are alive and important for the welfare of our environment. Discover all other benefits of trees and nature. Share the excitement which Maryam and Abdullah experience in planting and growing their first seed. Includes 19 colour illustrations,Children->Picture Books,50,3.95,3.95,3.95,0.25,,,,9780860373209,9780860373209.jpg,Rawaa El-Magazy | The Islamic Foundation | 2000 | 5-7 years | £0-5,taxable,zero-rate
Mawdudi: An Introduction to His Life and Thought,A booklet on select features of the life and thought of the great scholar and leader of the Islamic Movement. ,A booklet on select features of the life and thought of the great scholar and leader of the Islamic Movement. ,Books->Islam in General,50,1.95,1.95,1.95,0.07,,,,9780860370383,9780860370383.jpg,Khurshid Ahmad | Zafar Ishaq Ansari | The Islamic Foundation | 1979 | £0-5,taxable,zero-rate
Miraculous Happenings in the year of the elephant,'The greedy and power-hungry vice-regent Abrahah intends to divert the worlds pilgrims from Kaba, the House of Allah, in Makka, to the cathedral his slaves have built for him. But when the cathedrals spires finally slice the brilliant Yemeni skies and the magnificent doors are opened, the throngs Abrahah has been boasting about do not arrive. In a rage, he vows to destroy the Kaba, but Allah, theCauser of all causes, has other plans. True happenings, stranger by far than fiction, demonstrate that if He says, it is, it surely is.','The greedy and power-hungry vice-regent Abrahah intends to divert the worlds pilgrims from Kaba, the House of Allah, in Makka, to the cathedral his slaves have built for him. But when the cathedrals spires finally slice the brilliant Yemeni skies and the magnificent doors are opened, the throngs Abrahah has been boasting about do not arrive. In a rage, he vows to destroy the Kaba, but Allah, theCauser of all causes, has other plans. True happenings, stranger by far than fiction, demonstrate that if He says, it is, it surely is.','Children->The Prophet''s Biography',50,5.95,5.95,5.95,0.43,,,,9780860374916,9780860374916.jpg,Mehded Maryam Sinclair | The Islamic Foundation | 2008 | 5-7 years | £5-10,taxable,zero-rate
Morals and Manners in Islam: A Guide to Islamic Adab,'A compendium of rules regulating Islamic conduct at the personal, family, social and other levels. It is a brief yet comprehensive handbook for Muslims and those non-Muslims interested in acquiring a broad knowledge of the Muslim way of life. The book&rsquo;s contents, derived mainly from the Quran and the Sunnah, the main sources of Islamic jurisprudence, are listed in point format. A useful reference work for every Muslim family.','A compendium of rules regulating Islamic conduct at the personal, family, social and other levels. It is a brief yet comprehensive handbook for Muslims and those non-Muslims interested in acquiring a broad knowledge of the Muslim way of life.',Books->Islam in General,50,6.5,6.5,6.5,0.3,,,,9780860371687,9780860371687.jpg,Marwan Ibrahim Al-Kaysi | The Islamic Foundation | 1986 | £5-10,taxable,zero-rate
Muhammad (pbuh): The Perfect Model for Humanity,'This booklet tells how the Prophet has been the most influential figure in human history, representing a unique yet harmonious blending of roles as diverse as spiritual guide and military commander, devout worshipper and head of state.','This booklet tells how the Prophet has been the most influential figure in human history, representing a unique yet harmonious blending of roles as diverse as spiritual guide and military commander, devout worshipper and head of state.',Books->Hadith & Seerah,50,1.95,1.95,1.95,0.07,,,,9780860372240,9780860372240.jpg,Mustafa Ahmad al-Zarqa | The Islamic Foundation | 1992 | £0-5,taxable,zero-rate
Muhammad Man and Prophet ,'A fascinating account of events, from the start of revelations to the Prophet to the successful culmination of his efforts which united Arabia by its faith of Islam. Muhammad: Man and Prophet, analyses the distinguished life and career of the Prophet, while drawing material from authentic sources on Islam in Arabic. Written for both general readers and specialists.','A fascinating account of events, from the start of revelations to the Prophet to the successful culmination of his efforts which united Arabia by its faith of Islam. Muhammad: Man and Prophet, analyses the distinguished life and career of the Prophet, while drawing material from authentic sources on Islam in Arabic. Written for both general readers and specialists.',Books->Hadith & Seerah,50,39.95,39.95,39.95,1.42,,,,9780860373278,9780860373278.jpg,Adil Salahi | The Islamic Foundation| 2002 | £20+,taxable,zero-rate
Muhammad: Aspects of His Biography,'Heavily illustrated, this thrilling text gives some absorbing glimpses of the gloriously rich life of the Prophet, inspiring young people to emulate the best man that ever walked on Gods earth.','Heavily illustrated, this thrilling text gives some absorbing glimpses of the gloriously rich life of the Prophet, inspiring young people to emulate the best man that ever walked on Gods earth.','Children->The Prophet''s Biography',50,3.95,3.95,3.95,0.21,,,,9780860370239,9780860370239.jpg,Zaiuddin Sardar | The Islamic Foundation | 1982 | 12+ years | £0-5,taxable,zero-rate
Muslim Civilization - The cause for decline and the need for reform-PB,Muslim civilisation has experienced an overall decline during the last five centuries after having undergone a long period of prosperity and comprehensive development. Dr Chapra in this penetrating study has tried to examine the root causes and then discussed a reform programme that could help reverse the cycle of decline.,Muslim civilisation has experienced an overall decline during the last five centuries after having undergone a long period of prosperity and comprehensive development. Dr Chapra in this penetrating study has tried to examine the root causes and then discussed a reform programme that could help reverse the cycle of decline.,Books->Islam in General,50,12.99,12.99,12.99,0.32,,,,9780860374619,9780860374619.jpg,Umer Chapra | The Islamic Foundation | 2007 | £10-20,taxable,zero-rate
Muslim Nursery Rhymes,'Fifteen traditional English nursery rhymes, adapted with Islamic themes.','Fifteen traditional English nursery rhymes, adapted with Islamic themes. One of our best selling titles!',Children->Poetry & Anthologies,50,3.95,3.95,3.95,0.29,,,,9780860373421,9780860373421.jpg,Mustafa Yusuf McDermont | The Islamic Foundation | 2002 | 0-5 years | £0-5,taxable,zero-rate
Muslim Stories for Children (7CD Album),'CD1: Love at Home - A Great Friend of Children<BR>CD2: Stories of the Caliphs - Love All Creatures<BR>CD3: The Persecutor Comes Home - The Brave Boy<BR>CD4: The Long Search - The Longing Heart<BR>CD5: The Kingdom of Justice - Love Your God<BR>CD6: Love Your Brother, Love Your Neighbour - The Desert Chief<BR>CD7: The Wise Poet - Stories of the Broken Idol and the Jewish Rabbi<BR><BR><EM><STRONG>Stories Written by: </STRONG>Khurram Murad &amp; M.S Kayani<BR><STRONG>Introduced by:</STRONG></EM> <EM>Ibrahim B.&nbsp;Hewitt</EM><BR><EM><STRONG>Narrated By:</STRONG> Zia Mohyeddin, Yusuf Islam, Maryam Davies<BR><BR>Muslim Stories for Children</EM> is a series of audio CD&#39;s, it&nbsp;accompanies the popular set of 14 Children&#39;s Story books by Khurram Murad and M.S Kayani. <BR><BR><STRONG>Comes in a presentation storage box.</STRONG></FONT></P>','Listen to a compilation of stories full of moral values, interesting and exciting events to keep the family emgrossed for hours. ','Children->Audio, Poster, Other',50,25.53,25.53,25.53,0.36,,,,9780000000005,9780000000005.jpg,The Islamic Foundation | The Islamic Foundation | 1990 | 0-5 years | £0-5,taxable,zero-rate
New Friends New Places,'An account of a young British Muslim boy''s adventures during his visit to a family farm in Egypt while on summer holiday.','An account of a young British Muslim boy''s adventures during his visit to a family farm in Egypt while on summer holiday.',Children->Fiction->Children and Pre-Teen (7-11),50,2.95,2.95,2.95,0.11,,,,9780860372271,9780860372271.jpg,Susan Omar | The Islamic Foundation | 1993 | 7-9 years | £0-5,taxable,zero-rate
Objectives of the Islamic Economic Order,'A booklet on the nature, main features and objectives of the Islamic economic order, discusses universal brotherhood, justice, equitable distribution of income and freedom of the individual in the context of social welfare.','A booklet on the nature, main features and objectives of the Islamic economic order, discusses universal brotherhood, justice, equitable distribution of income and freedom of the individual in the context of social welfare.',Books->Islamic Economics,50,1.95,1.95,1.95,0.06,,,,9780860370512,9780860370512.jpg,Umer Chapra | The Islamic Foundation | 1979 | £0-5,taxable,zero-rate
Organ Transplantation Euthanasia Cloning And Animal Experimentation An Islamic View,'Muslims believe that everything they own has been given to them as a trust from Allah. Would it constitute a breach of that trust to consent to enrol oneself as an organ donor? While euthanasia may apparently alleviate suffering of the terminally ill, would that not compound their agony in the life hereafter? The author sheds lights on these issues and acqaints the reader with the latest rulings on these biotechnological manipulations.','Muslims believe that everything they own has been given to them as a trust from Allah. Would it constitute a breach of that trust to consent to enrol oneself as an organ donor? While euthanasia may apparently alleviate suffering of the terminally ill, would that not compound their agony in the life hereafter? The author sheds lights on these issues and acqaints the reader with the latest rulings on these biotechnological manipulations.',Books->Islam in General,50,4.95,4.95,4.95,0.2,,,,9780860373315,9780860373315.jpg,Abul Fadl Mohsin Ebrahim | The Islamic Foundation | 2001 | £0-5,taxable,zero-rate
Our Granddad,'This story takes up the sensitive subjects of sickness, old age and death. At the same time it beautifully highlights the full ethos of a Muslim family, with noble values such as respect for elders, affection towards the young, warm social relations, effective communication and strong bonding. Narrated in a captive style, this story is both delightful and instructive.  Includes 14 colour illustrations','This story takes up the sensitive subjects of sickness, old age and death. At the same time it beautifully highlights the full ethos of a Muslim family, with noble values such as respect for elders, affection towards the young, warm social relations, effective communication and strong bonding. Narrated in a captive style, this story is both delightful and instructive.  Includes 14 colour illustrations',Children->Islamic Studies,50,3.95,3.95,3.95,0.22,,,,9780860374053,9780860374053.jpg,Maryam Ahmad | The Islamic Foundation | 2006 | 5-7 years | £0-5,taxable,zero-rate
Our Grandma,'A delightful story which captures the special relationship between two children and their beloved Grandma. Surrounded by nature, Grandma teaches them how to appreciate Allah''s creation. The family are very happy until one day …  includes 20 colour illustrations','A delightful story which captures the special relationship between two children and their beloved Grandma. Surrounded by nature, Grandma teaches them how to appreciate Allah''s creation. The family are very happy until one day …  includes 20 colour illustrations',Children->Picture Books,50,3.95,3.95,3.95,0.27,,,,9780860374008,9780860374008.jpg,Zaynab Dawood | The Islamic Foundation | 2005 | 5-7 years | £0-5,taxable,zero-rate
Perceptions of Islam in European Writings,'This study contributes significantly to the dialogue between Islam and the West a field which has tended to be dominated by mainly non-Muslim writers. Primarily concerned with an intellectual history of Western, mainly English and French, writers; responses to Islam from about 1787 to the 1890s, the author uses both European and Islamic source materials in his study. His thorough evaluation of writers including Toderini, Boulainvillier, Sylvestre de Sacy, Byron, Edward Lane, Gobineau and Renan, does justice to the European tradition of writing on Islam. At the same time, the scholarly Muslim point of view is sustained by the use of Islamic source materials which have won the esteem of the Muslim community throughout the centuries.','This study contributes significantly to the dialogue between Islam and the West a field which has tended to be dominated by mainly non-Muslim writers. Primarily concerned with an intellectual history of Western, mainly English and French, writers; responses to Islam from about 1787 to the 1890s, the author uses both European and Islamic source materials in his study. ',Books->History,50,11.95,11.95,11.95,0.46,,,,9780860373780,9780860373780.jpg,Ahmad Gunny | The Islamic Foundation | 2003 | £10-20,taxable,zero-rate
