title,description,short_description,Category,stock,price,regular_price,sales_price,weight,length,width,height,sku,picture,tags,tax_status,tax_class
Perceptions of Islam in European Writings,'This study contributes significantly to the dialogue between Islam and the West; a field which has tended to be dominated by mainly non-Muslim writers. Primarily concerned with an intellectual history of Western, mainly English and French, writers; responses to Islam from about 1787 to the 1890s, the author uses both European and Islamic source materials in his study. His thorough evaluation of writers including  Toderini, Boulainvillier, Sylvestre de Sacy, Byron, Edward Lane, Gobineau and Renan, does justice to the European tradition of writing on Islam. At the same time, the scholarly Muslim point of view is sustained by the use of Islamic source materials which have won the esteem of the Muslim community throughout the centuries.','This study contributes significantly to the dialogue between Islam and the West a field which has tended to be dominated by mainly non-Muslim writers. Primarily concerned with an intellectual history of Western, mainly English and French, writers; responses to Islam from about 1787 to the 1890s, the author uses both European and Islamic source materials in his study. ',Books->Islam in General,50,19.95,19.95,19.95,0.57,,,,9780860373735,9780860373735.jpg,Ahmad Gunny | The Islamic Foundation | 2003 | £10-20,taxable,zero-rate
Perspectives on Morality and Human Well Being ,This title presents the ethical foundations of economics in general and of Islamic economics in particular. It explicitly recognises that individual economic well-being has a deep moral basis which is rooted in religious belief.,This title presents the ethical foundations of economics in general and of Islamic economics in particular. It explicitly recognises that individual economic well-being has a deep moral basis which is rooted in religious belief.,Books->Islamic Economics,50,13.95,13.95,13.95,0.35,,,,9780860373872,9780860373872.jpg,Prof. Syed Nawab Haider Naqvi | The Islamic Foundation | 2003 | £10-20,taxable,zero-rate
Perspectives on Morality and Human Well-Being ,This title presents the ethical foundations of economics in general and of Islamic economics in particular. It explicitly recognises that individual economic well-being has a deep moral basis which is rooted in religious belief. ,This title presents the ethical foundations of economics in general and of Islamic economics in particular. It explicitly recognises that individual economic well-being has a deep moral basis which is rooted in religious belief.,Books->Islamic Economics,50,19.95,19.95,19.95,0.46,,,,9780860373285,9780860373285.jpg,Prof. Syed Nawab Haider Naqvi | The Islamic Foundation | 2003 | £10-20,taxable,zero-rate
Pioneers of Islamic Scholarship,'Over the fourteen centuries of its existence, Islamic scholarship has produced numerous individuals who have distinguished themselves by acquiring broad knowledge and deep insight. However, true distinction is only achieved through a lasting influence, particularly when the area of scholarship is a religion that presents itself as being suited to all communities at all times. The selection has to start with the founders of the eight schools of jurisprudence who have had a continuous following over the centuries up to the present day. This book introduces nine scholars from these schools and adds two more from a much later era whose influence extended far beyond the area of pure scholarship. In simple language, this book gives a clear picture of how the Islamic schools of jurisprudence differ in their methodologies, showing at the same time how much interaction they project. It serves as a primary source for those who wish to follow a course in Islamic studies, this book is indispensable for others who wish to have a fair but concise idea about the most important personalities who have shaped Islamic scholarship for centuries.','Over the fourteen centuries of its existence, Islamic scholarship has produced numerous individuals who have distinguished themselves by acquiring broad knowledge and deep insight. However, true distinction is only achieved through a lasting influence, particularly when the area of scholarship is a religion that presents itself as being suited to all communities at all times. The selection has to start with the founders of the eight schools of jurisprudence who have had a continuous following over the centuries up to the present day.',Books->Islam in General,50,8.95,8.95,8.95,0.28,,,,9780860375708,9780860375708.jpg,Adil Salahi | The Islamic Foundation| 2006| £5-10,taxable,zero-rate
Prophet Muhammad in French and English Literature: 1650-Present,'This magisterial survey of the Prophet Muhammad in French and English literature over 350 years is both a cross-cultural history and a discussion of the intellectual changes in the representation of the Prophets life based on the close examination of original published and unpublished manuscripts. It is in the mid-seventeenth century that serious Western responses to Muhammad (PBUH) first emerge, but the now common acceptance of his status as Prophet has been relatively recent. While there have been many attempts to renew Islamic studies in the West, Gunny argues that it is not necessary to discard Islamic sources to achieve this aim.',This magisterial survey of the Prophet Muhammad in French and English literature over 350 years is both a cross-cultural history and a discussion of the intellectual changes in the representation of the Prophets life based on the close examination of original published and unpublished manuscripts.,Books->History,50,24.99,24.99,24.99,0.8,,,,9780860374787,9780860374787.jpg,Ahmad Gunny | The Islamic Foundation | 2010 | £20+,taxable,zero-rate
Public Duties in Islam: The Institution of the Hisba,An exposition of the theory of Hisba in the wider context of a just society and an efficient market economy.,An exposition of the theory of Hisba in the wider context of a just society and an efficient market economy.,Books->Islamic Economics,50,12.95,12.95,12.95,0.23,,,,9780860371137,9780860371137.jpg,Ibn Taymiyyah | The Islamic Foundation | 1982 | £10-20,taxable,zero-rate
Quranic Keywords: A Reference Guide,'Quranic Keywords: A Reference Guide provides a concise and authoritative guide to over 140 keywords in the Quran. The full meanings of each keyword are given, with Quranic citations, and discussion of allied and related terms to be found in the Holy Book. This is an ideal guide for students of the Quran at both beginner and intermediate levels, with helpful indexes of Arabic and English terms.   "...The book is a valuable addition to the Quranic literature in English and it is worth having in every Muslim home as...a reference book." Syed Salman Nadvi, Former chairman, Department of Islamic Studies, Durban University.','Quranic Keywords: A Reference Guide provides a concise and authoritative guide to over 140 keywords in the Quran. The full meanings of each keyword are given, with Quranic citations, and discussion of allied and related terms to be found in the Holy Book.','Books->Qur''an',50,10.99,10.99,10.99,0.37,,,,9780860374466,9780860374466.jpg,Abdur Rashid Siddiqui | The Islamic Foundation | 2008 | £10-20,taxable,zero-rate
Rashid and the Haupmann Diamond,'Rashid and his friends witness a robbery at Mrs. Wilson''s House, but police find no evidence of a breakin. The boy''s investigation leads them to an old map marking the location of a precious diamond. But who will reach the diamond first? Family values, and friendship that cut accross ethnic and religious boundaries are highlighted in this fast-moving adventure.','Rashid and his friends witness a robbery at Mrs. Wilson''s House, but police find no evidence of a breakin. The boy''s investigation leads them to an old map marking the location of a precious diamond. But who will reach the diamond first? Family values, and friendship that cut accross ethnic and religious boundaries are highlighted in this fast-moving adventure.',Children->Fiction->Children and Pre-Teen (7-11),50,3.75,3.75,3.75,0.12,,,,9780860373575,9780860373575.jpg,Hassan Radwan | The Islamic Foundation | 2002 | 9-11 years | £0-5,taxable,zero-rate
Rashid And The Missing Body,'Rashid and his mates learn about friendship, duty, and the importance of standing up for truth as they investigate the strange case of the missing body..','Rashid and his mates learn about friendship, duty, and the importance of standing up for truth as they investigate the strange case of the missing body..',Children->Fiction->Children and Pre-Teen (7-11),50,2.95,2.95,2.95,0.1,,,,9780860373957,9780860373957.jpg,Hassan Radwan | The Islamic Foundation | 2001 | 9-11 years | £0-5,taxable,zero-rate
Rays of Truth: Poems on Islam,'A collection of inspirational poems on a variety of topics, especially suitable for young people. Decorated with Islamic calligraphy and patterns in pastel colours.','A collection of inspirational poems on a variety of topics, especially suitable for young people. Decorated with Islamic calligraphy and patterns in pastel colours.',Children->Poetry & Anthologies,50,2.95,2.95,2.95,0.13,,,,9780860372639,9780860372639.jpg,Ayesha bint Mahmood | The Islamic Foundation | 1997 | 7-9 years | £0-5,taxable,zero-rate
Remembrance and Prayer: The Way of Prophet Muhammad,An in-depth description how the Prophet Muhammad used to remember Allah and pray to Him. The intimate relationship with Allah which was the hallmark of the Prophetic life becomes clear and vivid.,An in-depth description how the Prophet Muhammad used to remember Allah and pray to Him. The intimate relationship with Allah which was the hallmark of the Prophetic life becomes clear and vivid.,Books->Hadith & Seerah,50,6.95,6.95,6.95,0.32,,,,9780860371717,9780860371717.jpg,Muhammad Al-Ghazali | The Islamic Foundation | 1986 | £5-10,taxable,zero-rate
Rethinking Islam and Modernity: Essays in Honour of Fathi Osman,Rethinking Islam and Modernity: Essays in Honour of Fathi Osman,Rethinking Islam and Modernity: Essays in Honour of Fathi Osman,Books->Islam in General,50,7.95,7.95,7.95,0.29,,,,9780860373803,9780860373803.jpg,Abdelwahab El Affendi | The Islamic Foundation | 2001 | £5-10,taxable,zero-rate
Return of the Pharaoh: Memoirs in Nasirs Prison,'An inspirational and motivational account of a leading woman figure of the Islamic movement who was falsely accused in 1965 of conspiring to kill Jamal Abd al-Nasir, the President of Egypt. ','An inspirational and motivational account of a leading woman figure of the Islamic movement who was falsely accused in 1965 of conspiring to kill Jamal Abd al-Nasir, the President of Egypt. ',Books->Society & Politics,50,5.95,5.95,5.95,0.29,,,,9780860372400,9780860372400.jpg,Zainab al-Ghazali | The Islamic Foundation | 1992 | £5-10,taxable,zero-rate
Role of the State in the Economy: An Islamic Perspective,Presents an important subject against the background of the collapse of state-managed economics. Articles included in this collection discuss how Islam seeks to orient economic agents towards ethical and socially responsible behaviour.,Presents an important subject against the background of the collapse of state-managed economics. Articles included in this collection discuss how Islam seeks to orient economic agents towards ethical and socially responsible behaviour.,Books->Islamic Economics,50,9.95,9.95,9.95,0.24,,,,9780860372523,9780860372523.jpg,Muhammad Nejatullah Siddiqi | The Islamic Foundation | 1996 | £5-10,taxable,zero-rate
Role of the State in the Economy: An Islamic Perspective ,Presents an important subject against the background of the collapse of state-managed economics. Articles included in this collection discuss how Islam seeks to orient economic agents towards ethical and socially responsible behaviour. ,Presents an important subject against the background of the collapse of state-managed economics. Articles included in this collection discuss how Islam seeks to orient economic agents towards ethical and socially responsible behaviour.,Books->Islamic Economics,50,19.95,19.95,19.95,0.35,,,,9780860372516,9780860372516.jpg,Muhammad Nejatullah Siddiqi | The Islamic Foundation | 1996 | £10-20,taxable,zero-rate
Rural Development Through Islamic Banks,Rural Development Through Islamic Banks,Rural Development Through Islamic Banks,Books->Islamic Economics,50,2.95,2.95,2.95,0.12,,,,9780860372394,9780860372394.jpg,Muhammad Akram Khan | The Islamic Foundation | 1994 | £0-5,taxable,zero-rate
Seven Steps to Moral Intelligence ,'How do we develop a good understanding of right and wrong? How do we change ourselves so that we can live by the universal moral values of Islam? This straightforward guide tell us how to do this in seven steps including self-motivation, realising that we need to change and that change is possible for us, self-examination, self-control, how to go about changing ourselves, and monitoring our progress. Based on the teachings of Imam al-Ghazali and upon years of practical experience in teaching young Muslims, Dr Musharraf Hussain has given us a contemporary and accessible way to understand and apply Islamic teachings to character building.','How do we develop a good understanding of right and wrong? How do we change ourselves so that we can live by the universal moral values of Islam? This straightforward guide tell us how to do this in seven steps including self-motivation, realising that we need to change and that change is possible for us, self-examination, self-control, how to go about changing ourselves, and monitoring our progress.',Books->Islam in General,50,3.99,3.99,3.99,0.17,,,,9781847740090,9781847740090.jpg,Musharraf Hussain | Kube Publishing | 2009 | £0-5,taxable,zero-rate
Shades of Islam: Poems For a New Century,'Shades of Islam is a dazzling and moving collection of poetry that addresses faith, love, politics and Islam in the twenty-first century. Reviews - "I find [the poems] deeply moving and beautifully felt and written with simplicity and a profundity that is wholly disarming." - Harold Schweizer, Professor of English, Bucknell University.  "The poems of Rafey Habib offer a window onto the sensibility of a modern American Muslim, with unlinching honesty and richly informed compassion. The great humanistic tradition of poetry known in Arabic and other Eastern languages here finds a contemporary English voice, which will be recognized like a lost friend who has unaccountably been rediscovered." - Carl W. Ernst, William R. Kenan, Junior, Distinguished Professor of Religious Studies, UNC-Chapel Hill.','Shades of Islam is a dazzling and moving collection of poetry that addresses faith, love, politics and Islam in the twenty-first century.',Books->Islam in General,50,6.99,6.99,6.99,0,,,,9781847740212,9781847740212.jpg,Rafey Habib | Kube Publishing | 2010 | £5-10,taxable,zero-rate
'Sharing Eden: Green teachings from Jews, Christians and Muslims','Sharing Eden sets out to show how respect for the environment is at the heart of the Jewish, Christian and Muslim faiths. Todays environmental concerns can trace their heritage through scriptures, teachings and actions known to generations across the centuries. The millions of followers of the Abrahamic faiths have the potential to turn their common environmental awareness into a worldwide force for the future of the planet they share with all people of faith and of none. Combining a lightness of touch with some of the most beautiful and enlightening texts from the Abrahamic scriptures, Sharing Eden is just a beginning.  "Finding common ground between Christianity, Islam and Judaism is a critical priority for the whole world  and nowhere is that common ground more evident or inspiring than on environmental issues." Jonathon Porritt','Sharing Eden sets out to show how respect for the environment is at the heart of the Jewish, Christian and Muslim faiths. Todays environmental concerns can trace their heritage through scriptures, teachings and actions known to generations across the centuries. The millions of followers of the Abrahamic faiths have the potential to turn their common environmental awareness into a worldwide force for the future of the planet they share with all people of faith and of none.',Books->Islam in General,50,4.99,4.99,4.99,0.18,,,,9781847740410,9781847740410.jpg,Natan Levy | David Shreeve | Harfiyah Haleem | Kube Publishing | 2012 | £0-5,taxable,zero-rate
Splitting the Moon: A Collection of Islamic Poetry ,'Splitting the Moon, Joel Hayward''s second major collection, includes poems about his conversion to Islam from Christianity, his journey of faith, his experiences and observations as a British Muslim, and thoughts on the state of Muslims today. The poems are deeply personal, reflecting upon the ever-changing world around us.','Splitting the Moon, Joel Hayward''s second major collection, includes poems about his conversion to Islam from Christianity, his journey of faith, his experiences and observations as a British Muslim, and thoughts on the state of Muslims today. The poems are deeply personal, reflecting upon the ever-changing world around us.',Books->Islam in General,50,5.95,5.95,5.95,0.17,,,,9781847740342,9781847740342.jpg,Joel Hayward | The Islamic Foundation | 2012 | £5-10,taxable,zero-rate
Stories of the Caliphs,'Five striking stories which illustrate the simplicity and devotion of the caliphs Abu Bakr, Umar and Umar the second. Illustrated in colour. ','Five striking stories which illustrate the simplicity and devotion of the caliphs Abu Bakr, Umar and Umar the second. Illustrated in colour. ',Children->Non Fiction->Islamic History,50,2.25,2.25,2.25,0.1,,,,9780860371168,9780860371168.jpg,M.S Kayani | Khurram Murad | The Islamic Foundation | 1982 | 7-9 years | £0-5,taxable,zero-rate
Sudan: The Christian Design,'Presents a Sudanese point of view of the history, role and dimension of Christian missionary activities in the Sudan and their impact during the period 1843 to 1986. ','Presents a Sudanese point of view of the history, role and dimension of Christian missionary activities in the Sudan and their impact during the period 1843 to 1986. ',Books->Comparative Religion,50,5.95,5.95,5.95,0.23,,,,9780860371939,9780860371939.jpg,Hassan Makki Mohamed Ahmed | The Islamic Foundation | 1989 | £5-10,taxable,zero-rate
Sunshine at Madinah,'A sequel to, ''The Life of the Prophet in Makkah'' and ''Hijra'', it presents the life of the Prophet in Madinah from a new perspective, highlighting the nature and characteristics of the society and the state he was able to establish. The book contains a vivid description of the inspiring and moving events that took place in Madinah during the last ten years of the Prophet''s mission. The outstanding feature of this book is that the author looks at the life of the Prophet through the prism of the Qur''an keeping in mind contemporary problems of Muslim society.','A sequel to, ''The Life of the Prophet in Makkah'' and ''Hijra'', it presents the life of the Prophet in Madinah from a new perspective, highlighting the nature and characteristics of the society and the state he was able to establish.',Books->Hadith & Seerah,50,7.95,7.95,7.95,0.31,,,,9780860371960,9780860371960.jpg,Zakaria Bashier | The Islamic Foundation | 1990 | £5-10,taxable,zero-rate
Tales of Mercy,'Based on two stories from Hadith, this book successfully illustrates the importance of repentance for one''s sins, and the all-encompassing mercy of God.','Based on two stories from Hadith, this book successfully illustrates the importance of repentance for one''s sins, and the all-encompassing mercy of God.','Children->The Prophet''s Biography',50,2.25,2.25,2.25,0.07,,,,9780860372219,9780860372219.jpg,Anwar Cara | The Islamic Foundation | 1992 | 7-9 years | £0-5,taxable,zero-rate
Tazkiyah The Islamic Path of Self Development,'There is hardly any book in English that covers self-development from an authentic Islamic perspective. Yet, tazkiyah, self-development, lies at the core of Islamic life and there is need for a practical manual in English to assist those who want to achieve self-development by purifying their souls and actions. This anthology has been compiled to meet this need, by translating works that originally appeared in Urdu. It includes key contributions presented by well-known leaders of the Islamic Movement: Mawlana Mawdudi, Ustadh Khurram Murad and others.','There is hardly any book in English that covers self-development from an authentic Islamic perspective. Yet, tazkiyah, self-development, lies at the core of Islamic life and there is need for a practical manual in English to assist those who want to achieve self-development by purifying their souls and actions. This anthology has been compiled to meet this need, by translating works that originally appeared in Urdu',Books->Spirituality & Theology,50,6.95,6.95,6.95,0.39,,,,9780860373490,9780860373490.jpg,Abdur Rashid Siddiqui | The Islamic Foundation | 2004 | £5-10,taxable,zero-rate
Thank You Oh Allah,' Poetic reflections on Allah''s never-ending blessings, inspiring gratitude to the Creator. Includes 19 colourful illustrations',' Poetic reflections on Allah''s never-ending blessings, inspiring gratitude to the Creator. Includes 19 colourful illustrations',Children->Picture Books,50,3.95,3.95,3.95,0.25,,,,9780860373353,9780860373353.jpg,Ayesha bint Mahmood | The Islamic Foundation | 2000 | 0-5 years | £0-5,taxable,zero-rate
The Brave Boy ,Inspiring stories from the childhood and youth of the great caliph and companion Sayedena Ali.,Inspiring stories from the childhood and youth of the great caliph and companion Sayedena Ali.,Children->Fiction->Young Adults (12+),50,2.5,2.5,2.5,0.08,,,,9780860371120,9780860371120.jpg,M.S Kayani | Khurram Murad | The Islamic Foundation | 1982 | 7-9 years | £0-5,taxable,zero-rate
The Childrens Book of Islam (Part 1),Elementary book of Islamic beliefs. Suitable for Key Stage 2 (includes workbook),Elementary book of Islamic beliefs. Suitable for Key Stage 2 (includes workbook),Children->Islamic Studies,50,2.5,2.5,2.5,0.1,,,,9780950395418,9780950395418.jpg,M. Manazir Ahsan | The Islamic Foundation | 1980 | 5-7 years | £0-5,taxable,zero-rate
The Childrens Book of Islam (Part 2),Elementary book of Islamic worship. Suitable for Key Stage 2 &3 (includes workbook) ,Elementary book of Islamic worship. Suitable for Key Stage 2 &3 (includes workbook) ,Children->Islamic Studies,50,2.5,2.5,2.5,0.11,,,,9780860370376,9780860370376.jpg,M. Manazir Ahsan | The Islamic Foundation | 1981| 7-9 years | £0-5,taxable,zero-rate
The Colour Blind Boy,'Abdullah has just moved to a new school. As a newcomer, he find himself victim of gang who starts bullying him. Help comes from an unexpected quarters, a new friendship is struck between Abdullah and his friend, together they confront the bullies and the friendship is develloped in its true Islamic Meaning.','Abdullah has just moved to a new school. As a newcomer, he find himself victim of gang who starts bullying him. Help comes from an unexpected quarters, a new friendship is struck between Abdullah and his friend, together they confront the bullies and the friendship is develloped in its true Islamic Meaning.',Children->Fiction->Children and Pre-Teen (7-11),50,3.95,3.95,3.95,0.22,,,,9780860373841,9780860373841.jpg,Mohammed Yaseen | The Islamic Foundation | 2005 | 7-9 years | £0-5,taxable,zero-rate
The Courageous Children,Six stories based on original sources illustrate the tremendous dedication and bravery of the young Companions of the Prophet in defending Islam.,Six stories based on original sources illustrate the tremendous dedication and bravery of the young Companions of the Prophet in defending Islam.,Children->Non Fiction->Islamic History,50,2.5,2.5,2.5,0.15,,,,9780860371946,9780860371946.jpg,Ayesha Abdullah Scott | The Islamic Foundation | 1989 | 9-11 years | £0-5,taxable,zero-rate
The Desert Chief: Story of Thumama Ibn Uthal ,Moving account of how a proud and powerful chieftain came to embrace Islam as a result of the humane treatment shown to him by the Prophet during his captivity.,Moving account of how a proud and powerful chieftain came to embrace Islam as a result of the humane treatment shown to him by the Prophet during his captivity.,Children->Non Fiction->Islamic History,50,2.5,2.5,2.5,0.08,,,,9780860371366,9780860371366.jpg,Khurram Murad | The Islamic Foundation | 1984 | 9-11 years | £0-5,taxable,zero-rate
The Duties of Brotherhood in Islam,Al-Ghazali shows how brotherhood can be an aid to spiritual purification and a source of help and comfort in this world.,Al-Ghazali shows how brotherhood can be an aid to spiritual purification and a source of help and comfort in this world.,Books->Spirituality & Theology,50,3.95,3.95,3.95,0.14,,,,9780860370680,9780860370680.jpg,Imam Al-Ghazali | The Islamic Foundation | 1997 | £0-5,taxable,zero-rate
